MCQ,Choices,Correct
What is biology?,a: The study of life | b: The study of rocks | c: The study of space | d: The study of computers,a
What is a major theme in biology?,a: Evolution | b: Chemistry | c: Physics | d: Mathematics,a
What is the importance of energy processing in organisms?,"a: Allows organisms to move, grow, and reproduce | b: Allows organisms to communicate | c: Allows organisms to sleep | d: Allows organisms to hibernate",a
What is a subdiscipline within biology?,a: Anatomy and physiology | b: Geology | c: Astronomy | d: Psychology,a
What is the diversity of life on Earth?,a: Immense | b: Limited | c: Nonexistent | d: Unknown,a
